id,subreddit,submission_id,score,comment_body
jhqiwmx,gso,12yu3xa,0.9,"I'm currently homeless and have been for the last 5 years due to a murder attempt that left me with a traumatic brain injury and thus unable to work for very long. I never imagined that life would bring me to where I am right now. To say this experience has opened my eyes to what this life is would be the understatement of the year, and it has made me a pretty vocal advocate. That being said.

To the people saying he should go to a shelter, because they don't want to see them. Shelters usually turn away more people than they serve. This can be for a multitude of reasons. They are full, someone not passing  a background check, history of addiction or alcohol abuse, or even a minor disagreement with an attendant or volunteer. Also, shelters are far from being safe, especially for vulnerable people. I can't stay in the shelter where I live because one of the people working there thinks I'm a Muslim.

To the folks lamenting that all homeless people are drug addicts or alcoholics. It is true that many have addictions, but it certainly isn't the case for all. Not to mention the fact that there are very few options for treatment. The fact is, every single person I know out here with an addiction also carries with them some sort of unresolved and untreated trauma. Most stemming from childhood abuse. And to make matters worse, 70%+ of homeless women report being sexually abused while homeless, with many of them stuck in ongoing abuse.

Also, keep this in mind. The number one reason for women who find themselves homeless is domestic violence.

Just my two cents."
jhq044o,gso,12yu3xa,-0.5,I always thought those things were to stop the skateboarders.
jhqnoo7,gso,12yu3xa,-0.9,The wealthiest nation in the world can fight wars wherever but won’t take care of their own. It really says something about the US.
jhq3xnc,gso,12yu3xa,-0.7,"I heard sometimes a raccoon will come by and take that apart. All the raccon needs is an allen key. Raccons with tools are bad for those things, racoons with portable power tools are worse."
jhqapgn,gso,12yu3xa,0.6,"I’m telling you all, the Housing First model saves: 

\-Lives

\-Money

\-You from having to see people in this state sleeping on the ground."
jhp66aq,gso,12yu3xa,-0.8,Like taking away outdoor places to rest is going to make people less homeless 🙄 the city is just kicking them while they’re down
jhquht8,gso,12yu3xa,-0.9,What a shitty way to treat a human being
jhpa2qe,gso,12yu3xa,-0.9,"This could also cause seating issues for overweight people, people with disabilities, and those with mobility challenges. Plus it’s ugly as fuck."
jhqho76,gso,12yu3xa,-0.9,"Right, let's spend money on making it harder on the homeless rather than spend money on making the homeless less homeless. What a noble society."
jhqbx4b,gso,12yu3xa,0.2,So what do the people responding here actively do to help homeless folks other than upvote and type opinions on the internet?
jgjth3b,gso,12ot7sc,-0.9,Dude looks like his whole life was a participation trophy.
jgjsfo1,gso,12ot7sc,-0.9,"Participation trophies are a pressing issue for literally 0 families in NC, but this is how the GOP thinks we want them to spend their time and our money.

How about dealing with some real issues, like ensuring access to healthcare for PoC, women, children, the underserved, homeless, etc.

How about trying to help reduce sexual assault in college campuses.

How about making sure everyone in NC has enough to eat.

I fucking hate these people."
jgjnvrx,gso,12ot7sc,-0.9,Goofy ass. Way to work on solving actual problems
jgjohz2,gso,12ot7sc,-0.4,So does he also wants all those unseemly confederate honoring statues taken down?
jgjwzkg,gso,12ot7sc,-0.9,"One of my steadfast rules in life is to never, ever trust a guy in a bow tie"
jgjr087,gso,12ot7sc,-0.5,So all confederate monuments and flags get banned too.. right?
jgjy393,gso,12ot7sc,-0.95,"“Hi, I’m a useless asshole fuckwad, what do you do?”"
jgjtjef,gso,12ot7sc,-0.5,"I mean, I don't particularly like the participation trophy thing, but it's also none of Raleigh's d*mn business. Let's see some of that small government stuff you keep talking about, dude."
jgjvrai,gso,12ot7sc,-0.6,This makes me curious about how cheaply I can get a bunch of trophies to hand out to kids.
jgjwczj,gso,12ot7sc,-0.9,This is what this guy is spending time on? This is what he views is a worthwhile problem to focus on in his district??? Can’t these people get their asses to work on some actual legislation that helps people for the love of Pete?
jigrefw,winstonsalem,134wsj4,0.6,It’s moving to the Winston Cup Museum!
jih12jl,winstonsalem,134wsj4,-0.9,We'll miss driving by you and never entering your restaurant only to be shocked when they close shop. Fare thee well!
jih5zcy,winstonsalem,134wsj4,0.6,I hate Arby’s but LOVE this sign. I’m glad it gets to live on.
jiily9m,winstonsalem,134wsj4,0.2,"This came up in my Reddit feed and I panicked for a second, thinking it was the one outside my local Arby’s.  I hope it brings you peace to know there’s still one on Sunset Blvd. in Los Angeles, lighting up the block in all its phallic glory"
jih40th,winstonsalem,134wsj4,-0.6,See how long it takes before the building becomes another fish table hut
jihw2rc,winstonsalem,134wsj4,0.4,There was a photographer and a few other people there as the second part of the sign came down when I drove by about 30 min ago
jigno1e,winstonsalem,134wsj4,-0.7,This is awful. Hopefully going to a collector and not a scrap yard
jihq35v,winstonsalem,134wsj4,0.1,"what a coincidence. There’s one of these in Athens, GA. I was randomly recommended this post and was really confused why it would be going to the Winston Salem museum"
jii7bni,winstonsalem,134wsj4,-0.3,There's only a relatively small number of those still around.
jiir3oq,winstonsalem,134wsj4,-0.6,"Arby’s, 45 years ago, I would buy 4 RB sandwiches for $2.39. Ie 1977. Now it’s 4 for $10, man inflation."
jgr4lgl,winstonsalem,12qpbtf,0.2,how do i buy the big hat?
jgr8jt7,winstonsalem,12qpbtf,-0.8,They never seemed to have more than two people working there. Guess they couldn't keep it staffed.
jgt75bn,winstonsalem,12qpbtf,0.9,That sign is an iconic local landmark. It needs to be preserved in some way.
jgr5c2f,winstonsalem,12qpbtf,-0.5,Okay...when I was a little kid I always thought those Arby's signs were a piece of deli roast beef falling onto a pile of already cut roast beef. I was in my 20's before someone told me it was a big hat. It still doesn't look like a hat to me...
jgrscz0,winstonsalem,12qpbtf,-0.6,This makes me very sad. This sign is a core memory that f my childhood.
jgsqxuf,winstonsalem,12qpbtf,0.3,"Grew up in Ardmore and went to Moore Elementary. Moved away at 14 and back to WS at 49. 

I remember seeing that Arby’s as I was driving through my old stomping grounds and couldn’t believe it was still RIGHT THERE after so many, many years. 

I’ll miss the history, but not the restaurant, as I never eat there. But it’ll be weird to not see that sign there once they take it down. 

Hmmm. Maybe they put a Shake Shack there for us?"
jgrpicu,winstonsalem,12qpbtf,-0.5,A great loss for the community. Never forget the tangy barbecue sauce and chicken tenders.
jgsp4kq,winstonsalem,12qpbtf,-0.3,"Sad to see. Does anyone remember the McDonald's in the golden arch building near Parkway Plaza? I was just a tiny tot, but remember going there."
jgrsrm1,winstonsalem,12qpbtf,-0.6,Why would they close this one instead of any of the other Winston Locations? The one on Jonestown gets almost zero traffic because of their ridiculously steep entrance.
jgs8y55,winstonsalem,12qpbtf,-0.4,"Definitely sad.

Any suggestions on what should replace it? Hopefully not a bank. My vote is Biscuitville"
jg6c3fj,winstonsalem,12ldk0f,0.9,Absolutely love the Moravian church!
jg7v491,winstonsalem,12ldk0f,0.9,Genuinely curious how this works.  This seems like a very cost effective way to reduce misery among your neighbors.  I would love to propose this in our church.
jg7fi0n,winstonsalem,12ldk0f,0.1,"Hey, I just moved here. Do I just give them my MyChart login and they handle the rest? Cheers 🍻"
jg81d0c,winstonsalem,12ldk0f,0.2,"The real issue here is that 3.3 million dollars of debt was settled for $15,000. Those bills didn't have to be that high in the first place. This is just in that community,imagine the money that is owed for medical bills Nation wide. It's unnecessary."
jg6jog4,winstonsalem,12ldk0f,-0.9,Debt the new slavery. Good for them.
jg9087j,winstonsalem,12ldk0f,0.9,"The Moravians are such kind people. I wish more Christians would just get back to the teachings of Christ and follow it. ""Love the Lord your God with all your heart, soul, and mind, and love your neighbour as yourself."" (Truncated paraphrase)

That's it. That's the command. No qualifiers or exceptions."
jg8la4w,winstonsalem,12ldk0f,-0.4,How do they convert 3.3million to just 15k?
jg8vy6h,winstonsalem,12ldk0f,0.0,can do all 3?
jg6tu36,winstonsalem,12ldk0f,-0.5,Uh can a church cancel debt by way of burning it?????
jglj3x3,winstonsalem,12ldk0f,-0.9,Love the no true straw man fallacy with calling it “real” Christianity. It also didn’t make me smile when the same church decided to start making noises on the street at TWO AM for Easter in a residential neighborhood including by a college student apartment during finals season
jgxweis,winstonsalem,12scglh,0.2,Wilbert is that you?!?!
jh10lof,winstonsalem,12scglh,0.4,Hello! That is my pig I live on Shattalon and have a police report filed can you please contact me so I can pic her up??
jgycpri,winstonsalem,12scglh,0.85,What a sweet baby!! If you are unable to keep it (**EDIT or find original owners**) please contact the humane society or 4H (https://forsyth.cc/CES/4-H/) to make sure that they get a quality rescue instead of being sent to slaughter!
jgy6qno,winstonsalem,12scglh,0.85,"Oh my goodness! Thank you for posting this. I'm sure someone is looking for this sweet baby. I unfortunately don't know anyone with pigs. But, I'm hoping my comment boosts this post somehow."
jgzqfoi,winstonsalem,12scglh,0.9,Thanks so much for taking it upon yourself to look out for this sweet little guy! Looks like there's a solid animal sanctuary in Chapel Hill that rescues pigs and could possibly take him. https://www.jennaandfriendsanimalsanctuary.org/about-us.html
jh101cu,winstonsalem,12scglh,0.2,Someone reported a missing pig last night right down the road so probably related to that.
jgy57cb,winstonsalem,12scglh,-0.9,My ex went missing a month ago dam she's struggling now
jh0kpum,winstonsalem,12scglh,0.75,That’s some pig!
jh0rgjy,winstonsalem,12scglh,0.9,Please do right by this little guy/girl. I don’t know any resources myself but it looks like it could use a good and safe home.
jh0w2ek,winstonsalem,12scglh,0.2,If you don't find it's owner let me know. My pig needs a companion.
jjdvvdt,winstonsalem,13busc0,0.2,"Thanks for the update, sounds like every workplace in the U.S. right now."
jjeeuml,winstonsalem,13busc0,0.6,I like the cut of his jib.
jjh5n5j,winstonsalem,13busc0,0.9,"I think every politician should have to do this type communication everyday. It takes 5 minutes, it let's us respond, shows the politician knowledge and gives us a sense of character of the politicians. Thank you  rep Jackson,  I'm sure you caught some flack when you first started this but I think it's great."
jjgt8nz,winstonsalem,13busc0,0.7,Hey sorry you’d have a rough week because you did the right thing
jjcv9gt,winstonsalem,13busc0,-0.6,Now do the left and their inability to make a deal to stop spending money that we don’t have.  Why can’t they support anything responsible with spending?  Makes no sense.  The debt ceiling fight isn’t about the debt ceiling. It’s about unchecked spending since Bush 2 from both insane parties.  Yes the right is responsible but so are you.  Can’t fix a problem til you acknowledge it exists.
jjcj4qi,winstonsalem,13busc0,-0.9,Get this BS off the W-S page.   The NC cesspool is bad enough.
jjei4v5,winstonsalem,13busc0,-0.9,Outta money lol
jjero35,winstonsalem,13busc0,-0.3,"Spending in government does not work like spending in a business.  They do four things — maintain debt as percentage of gdp, print money, pront money to pay debts, raise taxes"
jjczkge,winstonsalem,13busc0,0.2,"Yes, Jeff, who was seated this January, is to blame.

The debt ceiling isn't about deciding how to spend money, its about deciding whether to pay back the money you owe for what you already spent, just like paying your credit card bill isn't deciding how to spend money, but whether or not you follow through on your promise to pay back the credit card company, and living with the fallout to your credit if you don't.


If you're on board with cutting some wasteful spending, here is some low hanging fruit:

* $842 Billion in the ""defense"" budget, much of which goes directly to contractors like Lockheed Martin (2022 net profits $5.7 billion), Raytheon (2022 net profits $5.2 billion)

* $20 Billion in direct subsidies to Oil, Gas and Coal, much of which goes directly to the largest oil companies like Exxon (2022 net profits 55.74B, a 141% increase from 2021!), not to mention other indirect subsidies"
jjgl5k9,winstonsalem,13busc0,-0.6,It's funny how this only comes up when a Democrat holds the white house.
ji8bkzg,GreenvilleNCarolina,132smz4,-0.2,Me and my crew did all the storm drain through there. The reason the project took so long is because of the river flooding and taking out our roads making it impossible to get the machines through. It really was a sketchy job.
ji88ayv,GreenvilleNCarolina,132smz4,1.0,Man this is fantastic
jifetbe,GreenvilleNCarolina,132smz4,0.5,mmm chocolate milk river.
jirggzp,GreenvilleNCarolina,132smz4,-0.5,About damn time.
ji9l2of,GreenvilleNCarolina,132smz4,0.9,Thanks for all the work done!
ji9mlze,GreenvilleNCarolina,132smz4,-0.6,"Proud of it! Waste of money tho imo. Its gonna get washed out by the river constantly. Also it leads straight to the ghetto.  Its a foot highway for drugs lol.

&#x200B;

Getting the big storm drain box closest to that overhead veiw in was one of the scaryest things weve ever done. Swinging a 50,000lb concrete box over the drop off to the river with a machine that could hardly pick it up is SCARY"
jhsxo3i,GreenvilleNCarolina,12z3gxo,0.4,Maybe something pirate themed? Or something about Tar River?
jhu8ryi,GreenvilleNCarolina,12z3gxo,0.2,"I’m no expert on tourism but it would be great to have something like the Bananas. 

Give them a team other than the party animals to tour with."
jht2lex,GreenvilleNCarolina,12z3gxo,0.0,Emeralds
jhtrao1,GreenvilleNCarolina,12z3gxo,0.0,Greenville goblins
jhxf6ov,GreenvilleNCarolina,12z3gxo,0.3,"The university definitely has anything Pirates locked down, but I wouldn’t be opposed to something Tar River related.

Tar River Terrors

Tar River Thrillers

Tar Thrashers

Tarblooders"
jhy0yuh,GreenvilleNCarolina,12z3gxo,0.5,As long as it's not a fish 😀
jicljrp,GreenvilleNCarolina,12z3gxo,0.0,You mean like the Tar River Eels?
jicrorz,GreenvilleNCarolina,12z3gxo,-0.9,Yeah ... Eeww
jid92ko,GreenvilleNCarolina,12z3gxo,0.2,It was the first river creature I caught in the Tar.
jhvxknq,GreenvilleNCarolina,12zg24o,0.5,The margins on “homemade” booze are INSANE. Plus the convenience of having complementary offerings in close proximity.
jhxe5jx,GreenvilleNCarolina,12zg24o,0.3,"I kinda wish it was over on Dickinson Ave and was a cocktail bar for the over college age crowd. With that said, I’m still going to check it out when it opens!"
jhswrrz,GreenvilleNCarolina,12zg24o,-0.6,Why are they doing it on fifth street. Rent wise I feel like you could go somewhere cheaper
jht3e8e,GreenvilleNCarolina,12zg24o,0.5,"It's directly across the street from Sup Dogs, makes it much easier on the owner logistically to operate both of these businesses simultaneously."
jhvel7d,GreenvilleNCarolina,12zg24o,0.4,More business probably justifies it
jh6gjmo,GreenvilleNCarolina,12udw1l,-0.6,[Fire near New Bern](https://www.witn.com/2023/04/21/great-lakes-wildfire-consumes-7000-acres-croatan-national-forest/)
jh6jwwl,GreenvilleNCarolina,12udw1l,-0.5,"Smoke coming from the Croatan National Forest fire to the south of us.

Source: https://twitter.com/seansublette/status/1649469743688982528?s=46&t=s2zg6HD1QlWj6TgfMHFMRQ"
jh6eb8b,GreenvilleNCarolina,12udw1l,-0.9,End of the world
jh77zr6,GreenvilleNCarolina,12udw1l,0.2,omg I thought I was losing it for a moment!
jh73zo4,GreenvilleNCarolina,12udw1l,-0.5,wildfire 🫱🏼‍🫲🏽 google is free
jh788f9,GreenvilleNCarolina,12udw1l,-0.9,End of days bitches. IYKYK
jh9x4rr,GreenvilleNCarolina,12udw1l,-0.6,It’s extra yucky out there this morning.
jh7eprf,GreenvilleNCarolina,12udw1l,-0.7,"That article now says 35,000 acres! It was 7,000 just a few hours ago."
jh6glyf,GreenvilleNCarolina,12udw1l,-0.3,Time to stock up on toilet paper and frozen foods.
jh7uk98,GreenvilleNCarolina,12udw1l,0.0,I wish
jg88zzh,GreenvilleNCarolina,12lcnws,-0.5,I'm originally from Asheville. I've lived all over NC and the country; based on what you're looking for long term - it's not Greenville. Not a diss on Greenville by any means and I have my reasons for being here and some positive things to say but definitely not what you're looking for.
jg7m4ce,GreenvilleNCarolina,12lcnws,0.7,"Damn, lots of Greenville hate. It probably isn’t a good fit from reading your post but it is a great place to some people. Very affordable compared to other places in the state. It is growing and getting more amenities every year. I like it but understand why others may not."
jgapahu,GreenvilleNCarolina,12lcnws,-0.9,"RUN! I've lived in ENC my entire life. I grew up in an infinitely smaller, more rural area than Greenville, but I have never felt as out of place there as I have here. My husband and I moved here to finish college but ended up getting a deal to buy our rental that simply couldn't be refused, then COVID happened. I identify similarly to you with some added marginalization in the mix. I can't stress this to you enough... Greenville and Washington are not a good fit. College nightlife, religion, a handful of restaurants, and a couple of greenway parks are about all this place has to offer. If you would like your children to grow up around other children being raised with similar inclusive ideologies, keep searching. I'm postponing having children until we leave for this very reason.  Please do yourself a favor and look further west or just skip NC altogether."
jg61ep7,GreenvilleNCarolina,12lcnws,-0.6,"It sounds like you’d hate it in greenville tbh. It’s not somewhere i’d choose to raise a family. In fact, I moved away when I graduated bc I was pregnant and didn’t want to live there anymore. 


There is a concentrated population in a smallish geographical area, so the traffic is insane. It’s mostly all college students or working class/poverty. Downtown is almost exclusively bars & clubs"
jg65nl0,GreenvilleNCarolina,12lcnws,-0.9,"As a resident originally from Georgia who has been stuck here for 20ish years, I would not reccomend it! I've been stuck because of my husband and his reluctance to leave and complacency which has driven me mad but I digress. We're finally moving this summer.

Housing is affordable compared to those areas but it's 5+ hours from the mountains. You may be interested in the Triad region which is 2 hours from the mountains. Greensboro and Winston-Salem have LGBTQ+ friendly areas and more to do than Greenville. The jobs are also higher paying than here. Jobs in Pitt county don't pay very well and professionals are better compensated in that region and the Triangle. Housing is affordable in the Triad. 

I would definitely not recommend Greenville."
jg9j2lo,GreenvilleNCarolina,12lcnws,0.7,"Durham checks off most of what you’re looking for. G-Vegas ain’t it. Durham pros: probably the most inclusive, diverse, liberal city in the state. Nationally acclaimed restaurants, arts, things to do, family activities (check out the museum of life and science). Not the best school districts but they are improving. Not the most affordable housing either, current mass influx of folks moving here. For context I went to college in Greenville and lived there several years after, and still have lots of family there so visit often. Currently have lived in Dirham since 2019. Greenville holds a special place in my heart, but for the things you’re looking for I don’t think you’d be happy there. Similar reasons we haven’t moved back to Greenville."
jg6dskc,GreenvilleNCarolina,12lcnws,0.3,"A lot of people have said it is religious, but you can def still find groups who are inclusive. New bern has a quaint downtown (about an hour east). I have experienced that a lot of people stay because of the affordability and it is a good place to raise children. Unfortunately not many for trails, but there are a few. We have good barbeque though!"
jg8tfi0,GreenvilleNCarolina,12lcnws,0.7,"So, I’m moving to Greenville soon due to a job and it being somewhat close to family, plus more affordable CoL. I’m leaving lake life and mountains. I love to hike, am also liberal, and we share other similarities. Why am I doing it? My visit showed me that it’s not perfect by any means, but enough of the dots connect for me. I spent time with people who moved there for work at ECU, and they have families, and gave me the honest pros and cons. All things considered, I do not think it’s as terrible as people are suggesting (or we wouldn’t be moving there). I don’t love big city life, but I also don’t want life to be so rural that there aren’t bigger community events and multiple dining options. Greenville is a decent in-between and it seems property value will only increase, as it is growing. If you do move, maybe we can be friends."
jg6ahm6,GreenvilleNCarolina,12lcnws,0.9,"I would definitely recommend Greensboro for what you're looking for. Much closer to the mountains with a very LGBT friendly scene, good schools, and plenty to do."
jg9h524,GreenvilleNCarolina,12lcnws,-0.6,"I think you'd do better looking in central virginia or a sub-urb of Atlanta for political reasons. I'd also weigh your desire to not talk politics with people, might save every area you consider. Greenville is definitely conservative. I left before MAGA was a thing, but I'd imagine there's a decent portion of those types there, though they probably won't say it out loud."
jh1exsd,GreenvilleNCarolina,12t8wws,0.7,"30-32 games with college players from all over the country and improvements made to the stadium sound good to me. 

ECU Pirates baseball is over in June, so this could be fairly popular among area baseball fans imo"
jh1kjq2,GreenvilleNCarolina,12t8wws,0.9,This would be awesome
jgbpn27,GreenvilleNCarolina,12mmz2p,0.3,"I have heard tons of praise for Brileys. I fortunately haven’t had a chance to go there yet. I have had fantastic experiences with University Auto, but that was 10 years ago. 

I get my routine stuff done from Speedee Oil on Firetower because they NEVER try to offer me stuff I don’t need and I’m always in and out within 15-30 minutes it seems."
jgdizuz,GreenvilleNCarolina,12mmz2p,0.95,"Colony Tire. I go there regularly. They've never once tried to upsell me on anything ever. They won't recommend anything unless you absolutely need it because something is really wrong. Once I gave them an opportunity to do a brake inspection to see if I needed new brakes because it had been awhile since I had brake work done. Rather than coming out and telling me I needed new brakes, they told me that my current brakes should last another six months or more, depending on how much I drive. They topped off the brake fluid and I was good to go. They could have made an easy sale for brake repair on all four of my wheels that day (most repair shops definitely would have), but they ensured my loyalty instead by being straight with me."
jgekd4k,GreenvilleNCarolina,12mmz2p,0.75,Agree with SpeeDee oil on Firetower. Have never tried to sell me anything. Husband and wife run shop
jgdelyu,GreenvilleNCarolina,12mmz2p,0.6,I’ve always liked Firestone in Winterville tbh
jggrkj0,GreenvilleNCarolina,12mmz2p,0.9,"Capital Automotive on E. 10th Street has been great for us! And also the guys at Carolina Tire on N. Greene Street and Mark's Quick Lube are top notch!

I've heard good things about Immanuel Auto too but I don't have any experiences with them."
jgf0d2c,GreenvilleNCarolina,12mmz2p,0.9,"Wow, just looked them up and they have a ton of great reviews! Thanks for the recommendation."
jjwj7ei,GreenvilleNCarolina,13fl3c7,-0.5,"It definitely needs something, traffic on Evans backs up to nearly Greenville Blvd in the evening.  However, whoever though about the existing turns on Firetower Rd is an idiot.  They gave left turns and stop lights for some housing areas with few people and yet Dudley's Grant which has the most people doesn't get a left turn.  The spot where you have to turn around to access it isn't wide enough for many cars and particularly trucks to make a u-turn without having to come to a stop and reverse, which is clearly less safe than making a left turn from a protected median."
jjxbtoz,GreenvilleNCarolina,13fl3c7,-0.2,"Well crap, I was looking at buying land just off of Evan's. Guess I'll pass on it now, overall this will be good for the flow of traffic but hopefully there won't be more wannabe race car drivers."
