id,subreddit,submission_id,score,comment_body
jhjo0r0,Wilmington,12xk344,0.9,"This dude has a bright future in politics, especially if he continues to refrain from accepting ridiculous amounts of corporate donations.

If you're reading this, please please please make efforts to get corporate money out of politics. Constituents from both sides want this to happen. Please please push and push and push back against the establishment."
jhjfxl3,Wilmington,12xk344,-0.9,"They took him off camera when he said MTG is very, very smart because no one is saying that with a straight face."
jhj5o6x,Wilmington,12xk344,0.9,I'd give you my vote for President today.
jhjowa1,Wilmington,12xk344,-0.5,"The talking head said ""I'll be respectful"" and then, in the same breath, followed up with an ad hominem attack. This sounds like the ranting of a petulant child.

However... I don't think Mr. Jackson needed to respond to this particular bozo. I'd rather see more videos that focus on the nature of Congress."
jhjtyya,Wilmington,12xk344,0.5,I don’t even know Jeff’s political orientation but I’d vote for him.
jhj1nmm,Wilmington,12xk344,-0.9,"Honestly if you watch this sleezeball Guy Smiley dude on Newsmax and think ""OH boy now here is someone I can trust."" You are a simple person."
jhk0gvm,Wilmington,12xk344,0.1,"Hey congressman nobody. I'm more of a conservative, and moderate republican.... But I like the cut of your jib for being transparent and open with your communication. You got my vote President Nobody!

Let him eat his words. Makes me angry that these WWE wannabes are in the republican party... Just please don't get sucked into the nonsense.

Hi, I'm Troy McLure, you might remember me from such movies as "" Muppets go Midevil"" and """"P"" is for Psycho""!"
jhj1dts,Wilmington,12xk344,0.9,Love this guy. Keep it up Jeffy!
jhj4x78,Wilmington,12xk344,0.9,"Love love love what calmness, rationality, and simple, direct communication can reveal."
jhkaio0,Wilmington,12xk344,-0.9,"Outage as a Service (OaaS) - this is a new deep state, liberal run, left coast, Satan led, George Soros owned, Biden agenda, along with a  pelosi business model who is gonna come take your guns, kids, and liberty while switch your gas stove for an electric. /s

Don't these people ever get exhausted?"
jgmangm,Wilmington,12pfcmi,0.6,"I follow Jeff in ticktock.   He is what this country needs.  I would vote for him in a heart beat, and I am more of a republican than democrat."
jgmi0oz,Wilmington,12pfcmi,0.5,"Jokes on us.  Jeff is a complete maniac in closed meetings and he maintains a calm demeanor in public. 

Kidding of course.  Keep up the good work Jeff.  Wish I lived your district, but happy to see you in DC nonetheless."
jgmcf9h,Wilmington,12pfcmi,0.7,I like this guy.
jgm0r0a,Wilmington,12pfcmi,0.9,"I like the candid nature of these videos. Very straight forward, and refreshing compared to…well, most other media.

Are there other members of congress that have videos similar to this?"
jgmpmw2,Wilmington,12pfcmi,0.4,"I agree with and appreciate Jeff's sentiment in this video. All that I would add to it is that, while performative politics has sadly become the norm, millions of Americans aren't able to make that distinction, and buy into that inflammatory rhetoric as fact, even taking it as a call to arms, so they vote for the angriest and loudest voices. My question is, how do we combat that, and prevent NC (along with the rest of the country) from turning towards increasingly delusional, regressive policies. Because right now, things look pretty iffy, and the reasonable voices aren't being heard enough."
jgo0ly6,Wilmington,12pfcmi,0.9,The more this man talks the more I like him.
jglxmxl,Wilmington,12pfcmi,0.9,These posts are appreciated. Sad it has to be said though. Thank you for reaching out to the community here.
jgm3xia,Wilmington,12pfcmi,0.6,"There are 535 senators and representatives. About 12-15 are always in the news. Can't someone coordinate a 'silent majority' of congresspeople to counterbalance the attention whores? Not on political grounds, bipartisan, just to ask people, the media to stop responding to bad actors."
jgn8jgl,Wilmington,12pfcmi,-0.9,"Of course they are, because our “public servants” have turned into the D.C. political version of Hollywood actors. It seems relatively simple to me. We have a one party government with two clearly defined factions whose jobs are to provide we the the people this illusion that we have any meaningful measure of control over what happens on Capital Hill… we have none. (Kennedy tried to warn us, and was killed for it) It’s all an act, for which our public servants are paid handsomely while the majority of Americans are being crushed under the weight of the effects of their actions. These people are strangling the life out of this country and laughing all the way to the bank with their stolen American wealth as we all wonder how we are going to even survive each month."
jgnwe8e,Wilmington,12pfcmi,0.7,I long suspected this but it’s refreshing to hear it from someone who is actually there. Thank you Jeff.
jh1cdsf,Wilmington,12t6xy0,-0.5,"Seeing the Great Wall from space? Myth

Seeing the Self Storage at 3rd and Dawson? Confirmed"
jh1638g,Wilmington,12t6xy0,0.2,I can see my house from there!
jh1bc6d,Wilmington,12t6xy0,-0.9,Amazing from way up there you can appreciate how fucking terrible traffic on college rd is.
jh1512c,Wilmington,12t6xy0,0.2,"The photo is from https://eol.jsc.nasa.gov/SearchPhotos/photo.pl?mission=ISS069&roll=E&frame=3755 and is courtesy of the Earth Science and Remote Sensing Unit, NASA Johnson Space Center.  
  
This link has older photos of Wilmington, although they aren't all the right Wilmington: https://eol.jsc.nasa.gov/SearchPhotos/Technical.pl?SearchPublicCB=on&feat=Wilmington&SearchFeatCB=on&SearchGeonCB=on&IncludePanCB=on .  
  
If you'd like, you can watch the map at https://isspix.com/ISS069. It is a map of recent social media posts from the ISS. It takes a little time to load and works better on a desktop."
jh1mdxf,Wilmington,12t6xy0,0.0,Dang how much is rent on board the ISS?
jh1rwgt,Wilmington,12t6xy0,-0.5,Snows Cut is a fickle beast
jh345ek,Wilmington,12t6xy0,0.9,"This is really cool, thanks for sharing."
jh3iune,Wilmington,12t6xy0,0.9,"Nice share, thanks!"
jh3ny5g,Wilmington,12t6xy0,0.95,Man this is super cool! I see Wilmington from about 1500ft altitude all the time but this is a totally different level!
jh2kkkz,Wilmington,12t6xy0,-0.9,"miles of sprawl ✅
traffic you can see it from space✅
endless vinyl villages✅
that’s Wilmington alright"
jigm3at,Wilmington,134q1xo,0.9,"I appreciate Rep Jackson for always being straight with us. We aren’t stupid (well most of us aren’t) and having someone like him give these updates to things that will impact us is so important. We won’t hear this on the news. 

Thank you Mr Jackson… we need you, and preferably 534 more of you."
jiib7ci,Wilmington,134q1xo,0.7,"Interesting he’s doing the job of a the media. Feel like when I watch the news at night it should come off with this level if intellect, calming voice and letting me decide with the facts how I feel about it."
jij87ic,Wilmington,134q1xo,0.6,I want this guy to read me books.
jijzudf,Wilmington,134q1xo,0.9,He sets a good tone for what all leadership should be doing to help with transparency.
jigcomy,Wilmington,134q1xo,-0.6,"I like this guy well enough, but it seems this ""default"" issue is a perennial event, and which side you are on is determined by party politics and who is in control. And to his point, who faces re-election around the corner. 

In the end they will find some method to kick the can down the road, and then bark about how hard they fought for their voters in campaign ads."
jiiml2m,Wilmington,134q1xo,0.9,This guy is a gem
jijoaub,Wilmington,134q1xo,0.9,You’re the best!
jijxy3y,Wilmington,134q1xo,0.1,Please run for President!!!  But I’m sure he will be voted out next term.
jikmz9e,Wilmington,134q1xo,0.9,This is a government representative.... not a politician. We need people on both sides of the aisle willing to cut the shit and work together to make this country as great as we can for everyone.
jikwklp,Wilmington,134q1xo,0.9,"When a politician explains the news better than any news anchor, there's a MAJOR problem with our news sources."
jgt41cz,Wilmington,12r3ixd,0.9,I loved going there during Christmas. The huge Christmas tree over the corner door was awesome. Also loved the smell of the Pepperidge Farm section.
jgtbfto,Wilmington,12r3ixd,0.4,I didn’t read the caption and literally was like hey that looks a lot like the library 😅
jgsuz55,Wilmington,12r3ixd,0.9,Loved that store
jgtgtqm,Wilmington,12r3ixd,0.7,The animate Christmas window was always awesome.
jgtxma2,Wilmington,12r3ixd,0.4,"I’m just now finding out it’s, Belk “Beery” and not “Berry” lol! Nana loved her some Belk Berry’s"
jgtcjsk,Wilmington,12r3ixd,0.9,I love my public library
jgvgoy9,Wilmington,12r3ixd,0.9,I love the old Gulf sign!
jgtd98z,Wilmington,12r3ixd,0.5,Save the Library!
jgv1oaz,Wilmington,12r3ixd,-0.9,"I don't want to start a fight, but why are libraries still a thing ? And why is this one worth saving ? I'm not a fan of the current plans for it, but other than a homeless hub, who uses it ?"
jgzwubt,Wilmington,12r3ixd,0.3,Wow that cool . I knew was downtown but never saw pic of it
