id,subreddit,submission_id,score,comment_body
jglvi42,raleigh,12pf6ay,-0.6,"Was on a filght with MTG recently.  She was quiet and otherwise polite, even when someone grabbed her bag for her after it had to be placed in an overhead bin behind her.  Her act is just that - an act.  Doesn't make her any better of a person - just deceitful on top of everything else."
jglvdbi,raleigh,12pf6ay,0.3,"Honestly, not surprising. 

Still amazed that it works so well."
jglwgsc,raleigh,12pf6ay,0.9,"Mad respect to this guy. Tbh, I have absolutely no idea where he stands on most political issues, but anyone bringing more transparency and knowledge to the general public on the workings of Congress is doing God's work."
jgly71z,raleigh,12pf6ay,0.9,This guy seems like a sturdy individual. Clear communication without bias. We need more conversations like this
jglw3q7,raleigh,12pf6ay,0.6,"It's something we already pretty much knew but it doesn't feel any better confirming that's how some politicians act. This is why some folks say they don't follow politics(when they should) and its disheartening knowing these politicians can pretty much lie to the public and get away with it.  And this is what leads to terrible people getting reelected over and over again. Its all a farce. 

But thank you for calling it out and shining a spotlight on it. We need more politicians like you who are honest and calm in front of the public while being loud and fighting for our rights behind closed doors. At least that's what I hope you're doing."
jglxdg5,raleigh,12pf6ay,-0.3,"It''s that simple. Thanks for sharing. You left out the part where the oppositions has amicable lunches together.(behind closed doors, of course)"
jgmvrs5,raleigh,12pf6ay,0.9,This guy could have polar opposite political beliefs than me and I'd still hang on every word for his candor and demeanor alone. I miss when politicians at least pretended to be respectable
jglxun4,raleigh,12pf6ay,0.5,"I feel like this is something we all suspected as a ""conspiracy"", but none of us are surprised to know that it's real. The unfortunate part is that revealing the man behind the curtain often puts politicians in cross hairs, and we have already seen that with Jeff in recent weeks:

https://www.charlotteobserver.com/news/politics-government/article274208495.html

I imagine the more transparency he has with the public (which is obviously a positive thing) the more this will ramp up."
jgn3f2o,raleigh,12pf6ay,0.9,"Love the quote ""when you don't have to yell to be heard, the whole conversation changes"", that is the most real talk I've heard from a politician in awhile, definitely taking that one to heart"
jgms2h8,raleigh,12pf6ay,0.9,We need to protect this man at all costs. He’s so transparent that it makes me feel like he is doing something wrong. Like I fear for his life because he is being an actual advocate for his constituents. We have been fed bull crap for so long it’s become the norm. I hope it continues as he furthers his career.
jhjghcj,raleigh,12xjrfr,-0.4,"There are always approx. 3 reports on these posts, and we never remove the post. Why keep reporting it? Ugh.

Next time someone reports this post, I'm going to sticky it."
jhjah1b,raleigh,12xjrfr,0.5,"I can't get over the fact that you never actually named anyone, yet somehow this guy was able to pinpoint exactly who you were talking about AND prove your point about them in the same breath 🤣"
jhj5i8n,raleigh,12xjrfr,0.6,"Jeff Jackson should put ""Congressmen Nobody"" on shirts, stickers, hats, and buttons. It's actually a great nickname for a modest politician."
jhj4le3,raleigh,12xjrfr,0.5,"""Boring on social media"" is kind of a great compliment."
jhj0rbg,raleigh,12xjrfr,-0.5,"Wow that ""news"" show did not think the optics of that one through at all lol."
jhj3z9h,raleigh,12xjrfr,-0.9,"Wow, I don't even know what to say to this. People have to be willfully ignorant or completely crazy not to see past this ""guise""."
jhj3csu,raleigh,12xjrfr,0.2,I'd vote for Mr. Nobody
jhj1qfs,raleigh,12xjrfr,-0.7,Love how defensive they got and you know you got under their skin when they start  giving you names like “Mr. Nobody”.
jhj5zf2,raleigh,12xjrfr,-0.9,"According to Snopes, ""In a now-deleted Facebook post, (Marjoie Taylor) Greene suggested that laser beams from space may have started the 2018 California wildfires, and that among the entities behind this conspiracy were former California Gov. Jerry Brown, Pacific Gas & Electric, and Rothschild Inc., an investment firm frequently targeted by anti-Semitic conspiracy theorists.""

She has also chased a school shooting survivor.

And that's what this Newsmax anchor considers reasonable?"
jhj7r7b,raleigh,12xjrfr,-0.6,So MTG was silenced in a committee hearing by a member of her own party for being reasonable?
jicafbu,raleigh,133yp0d,-0.5,"I'd rather have a ""440 UGH"" personalized plate"
jiclg46,raleigh,133yp0d,-0.9,Come sit on 75 in Atlanta. It’s like a cemetery. No one’s moving.
jicj6lw,raleigh,133yp0d,-0.9,I literally just ordered I H8 I40
jic9w2f,raleigh,133yp0d,0.2,"I’ve seen this plate here before, and I’ve caught myself looking for it “in real life”"
jidf6tq,raleigh,133yp0d,0.5,Looool this was my best friends car forever and his moms before him. When he sold it I told him he should keep the license plate but I think he was glad to be rid of it. It was an iconic part of the carpool line.
jidr0qg,raleigh,133yp0d,0.9,"That made me laugh, mostly because I-40 is so insanely great (traffic and road conditions) compared to 1-95 (northeast and ATL), the 405 in LA, or the Dan Ryan (or really any of them) in Chicago.

Unfortunately, I’ve lived all over the US and in quite a few metropolitan areas and beautiful Raleigh is truly blessed with the best traffic situation I’ve dealt with in many years."
jicj3ec,raleigh,133yp0d,0.6,There's another person who drives a white Tesla model 3 that has a plate that says something like I H8 I-40. I see it in my morning commute a lot. Whoever these people are they need to know they are the unsung heroes... Spreading the word.
jicjh04,raleigh,133yp0d,-0.2,It has the month sticker on the plate too so they’ve had that plate for a long time.
jid4yen,raleigh,133yp0d,0.6,"It lives! I have a picture of this plate from 2018, glad to see this Lexus is still kicking it"
jic35wx,raleigh,133yp0d,-0.4,"If this is their plate, the traffic is their damn fault! 

“We are ALL traffic!” (Read in the voice of the famous lemur King Julian)

Yes funny, but imagine NOT having I-40. Enjoy HWY-54 ya dipshit! Ever tried driving to Wilmington at 45 mph? 

I merfkin love I-40."
jiul9sw,raleigh,137rg0t,-0.9,"So let me get this straight. Cotham ran as a Dem in support of womens rights to choose. Gave a speech on the House floor explaining that she had an abortion, saying, ""This decision was up to me, my husband, my doctor and my God. It was not up to any of you in this chamber."" As soon as she is elected as a democrat she switched parties to republican, giving them the super majority and now voted in favor of a BAN on abortions after 12 weeks of pregnancy. 

&#x200B;

How is that allowed? Is anyone else furious?"
jiuto8k,raleigh,137rg0t,-0.95,"[I took this image and took a deeper look.](https://imgur.com/a/Iz1bWgo)

Of these **71** people....

Only **9** ever had the ability to be pregnant

and of those 9, only **3** could even remotely ""[technically](https://www.plannedparenthood.org/blog/can-you-get-pregnant-at-any-age)"" be considered still of reproductive age. 

But, if we aren't kidding ourselves, most likely, **NOT A SINGLE PERSON WHO MADE THIS DECISION FOR ALL OF THE WOMEN OF NORTH CAROLINA WILL EVER BE FACED WITH THE REPRUCUSSIONS AND HEALTH RISKS OF THIS BAN**. 

It's absolutely disgusting."
jiuh8nx,raleigh,137rg0t,-0.9,"Just a reminder, Cotham has had an abortion, has rallied against abortion restrictions for many years, and has sold herself out because Tim Moore is good in bed.  Literally.

She must have a kink for authority as she used to be married to a state DNC chair."
jiuiaft,raleigh,137rg0t,0.5,That is one diverse crowd.
jiujh8l,raleigh,137rg0t,-0.9,And there's Cotham. What a fraud.
jiuo2jj,raleigh,137rg0t,-0.9,"Jesus, we've gotta get each and every one of these motherfuckers up out of the paint. This is ridiculous. This picture looks like an ad for ED medicine and potato salad with raisins. I hate this so much."
jiutfhd,raleigh,137rg0t,0.2,"Here’s the link to the actual bill, and a TL;DR I was able cobble together relative to the changes made to a women's right to choose an abortion.

[https://webservices.ncleg.gov/ViewBillDocument/2023/5440/0/S20-PCCS15344-BC-2](https://webservices.ncleg.gov/ViewBillDocument/2023/5440/0/S20-PCCS15344-BC-2)

The North Carolina General Assembly has introduced the ""Care for Women, Children, and Families Act,"" which covers a wide range of changes to healthcare laws and appropriations for healthcare programs. In addition to revising abortion laws, the legislation includes provisions to reduce infant and maternal mortality, provide parental leave for state employees, improve child permanency, facilitate safe surrender of infants, support foster care and adoption, and expand access to childcare.

The bill establishes the ""Woman's Right to Know Act,"" which requires doctors to display a real-time view of the unborn child before an abortion, and it prohibits partial-birth abortions. The legislation also includes informed consent and reporting requirements for abortions performed due to a life-limiting anomaly.

The document outlines specific time frames during which abortions can be performed based on different circumstances. During the first 12 weeks of pregnancy, a qualified physician licensed to practice medicine in a suitable facility can perform the abortion, either through surgical or medical means. After the 12th week and up to the 20th week, abortions can only be performed in cases of rape or incest. After the 20th week, abortions are only permitted if a qualified physician determines that there is a life-limiting anomaly.

The bill will take effect on a future date, with different sections of the legislation taking effect at different points in time."
jiuly6e,raleigh,137rg0t,-0.9,62 white men & 9 white women think they are in charge of your body
jiuv0hp,raleigh,137rg0t,-0.9,71 reasons why abortions could be great
jiuuga5,raleigh,137rg0t,-0.7,"Bodily autonomy is the most fundamental human right.  If you don't have that, you have no real rights at all.

You can also bet that 100% of the people in that photo, their spouses, their mistresses, and their children will all have access to abortion that they voted to deny the rest of us.

Considering that most of our state reps are pretty well off financially due to their various business interests (few of these people have real jobs - most own their own companies), it'd be a shame if someone publicized the companies they own or have a stake in.  

Just so we can vote with our wallets on days that *aren't* Election day."
jig3d3p,raleigh,134pwcs,-0.6,"Imagine politicians ego and pride controlling millions of livelihoods. Power is so insane, and money is the core issue. Government workers, especially are public SERVANTS, and should be viewed as such. 

Experts should make laws over areas they are experts in. Talking about defaults, let’s get a number of how many individuals in congress have an accounting degree, CPA certain, or advantaged mathematics degrees. 

Pretty sure most of congress needs help with email, it’s hopeless."
jig3haq,raleigh,134pwcs,0.9,Please run for an office that will let me vote for you. This level-headed communication and commitment to inform your voter base shouldn't be this novel.
jig2n5m,raleigh,134pwcs,0.9,"Thanks so much, Rep. Jackson! Love these short kinda eli5 videos to help digest what’s going on in the legislature."
jigl18l,raleigh,134pwcs,-0.6,Good to know that the American government lives paycheck to paycheck like the rest of us
jihm84y,raleigh,134pwcs,0.2,If he runs for president Seth MacFarlane will be a weekly SNL guest.
jig7t7d,raleigh,134pwcs,-0.5,"I've heard this so many times now. Do we actually start defaulting in 6 weeks? Previous times we would take measures like furloughs or reducing payments to servicing the interest of the debt. Why are we jumping straight to default this time?

Also from Jackson's previous post it seems like those hard lines conservatives will put on a show to hold people's attention (WWE style) but will be more sensible behind closed doors. Are we to expect that same behavior here?"
jigm4w2,raleigh,134pwcs,0.2,"Jeff, serious question here. Why can’t we just pass a continuation? Why is there no fail-safe to prevent a small group from holding the entire country hostage by allowing the previous budget to be automatically extended?

Bit of a loaded question here but what do you think the likely/realistic outcome is here?

Also, since I can’t vote for you as my rep Id love to buy you a beer at some point. You’re honestly putting the rest of our reps to shame."
jih9enq,raleigh,134pwcs,0.0,4* weeks. According to Yellen.
jighg74,raleigh,134pwcs,0.9,"I’m a big fan of these videos! Honestly, don’t know much about your politics, but I can get behind someone with transparency any day!!"
jih3l1t,raleigh,134pwcs,-0.9,Running out of money and about to default? Join the club!
jhj0ah1,Charlotte,12xj2hn,-0.9,"> Maybe he's president of the United States someday. Am I gonna have to eat these words?

Narrator: It was at this moment that he knew: he fucked up."
jhj2adb,Charlotte,12xj2hn,0.2,"Well done Jeff. It’s astounding to see how you can make a post on Reddit, not mention any specific names, and of course the Outrage Mafia immediately targets you.

If they are targeting you, it’s because you hit something IMPORTANT. If what you said had been a lie or not true, they would have dismissed it. But you hit on something they didn’t want highlighted, which is fantastic.

Please keep doing what you are doing. The national audience behind the Outrage Media doesn’t vote for you, we do. And I personally love the direct insight from you."
jhj4dan,Charlotte,12xj2hn,0.3,"So Jeff didn’t mention any names, and the “news” presenter immediately thinks it is Gaetz, Greene, and Boebert and goes to defend them. I mean if the shoe fits…."
jhizr0j,Charlotte,12xj2hn,-0.85,"I hope Congressman Nobody runs for higher office soon. Boring is good. After living through Trump as the so-called “President”, I want politicians who don’t make me feel like I have to watch the news every single day less I miss important information about the crazy shit they’re doing."
jhizpst,Charlotte,12xj2hn,0.6,"Love it. Give them rational discourse and let them freak out.   
Make a general statement naming no names, let them feign outrage and name names themselves, they know who the actors are. 

&#x200B;

Keep it up Jeff!"
jhj2wcg,Charlotte,12xj2hn,-0.9,"Congressman Nobody😂
Meanwhile, does anyone know who this witless taking head from the Walmart version of Fox News is??"
jhj45p1,Charlotte,12xj2hn,-0.5,Nobody 2028
jhj1f5w,Charlotte,12xj2hn,-0.4,For anyone who doesn’t know what news max is it’s the network my grandmother watches because “Fox News is too liberal” for her.  Lol
jhj9zml,Charlotte,12xj2hn,-0.5,"""Is this a maniac?""

\*Lists three practically certifiable maniacs\*"
jhj0vwx,Charlotte,12xj2hn,-0.9,"How did that news commentator know exactly whom this congress person was talking about?

Did they have some inner communication?  Is the news announcer summoning dark evil from beyond the veil to divine this congress person's specifics?"
jglukzl,Charlotte,12pf1oy,0.3,I've heard before that it's similar to the WWE at times. Thanks for this info.
jglxdah,Charlotte,12pf1oy,-0.3,"We can adjust our responses to what we see, but what is the long term fix for misaligned incentives like these? Clearly, we want media to pay attention to politics  and politicians, but when the media incentives are no longer to inform but to enrage, the media consumer will get the bad end of this. State run media? Yuck. Impartial media outlets lose share to the rabid ones. I just don't know how to address this systemically that isn't really unappealing."
jgm0ee6,Charlotte,12pf1oy,0.9,"I live just over the border in SC, but I'm so completely impressed with Rep. Jackson.  You guys in NC have a good one.  We are just stuck with Ralph Norman, and that dude is the worst."
jglyrt8,Charlotte,12pf1oy,0.9,"This guy might be the most honest and transparent politician in office...not sure how anyone with any political affiliation, wouldn't highly respect that.

Gonna be really interesting to see how that brand of integrity ultimately helps or hinders his career."
jgm5f42,Charlotte,12pf1oy,0.9,"You're the last glimmer of hope I have for North Carolina right now, Jeff. Thanks for all  you do. Thank you for your integrity and transparency. These are hard qualities to come by in your line of work."
jgm0w32,Charlotte,12pf1oy,-0.8,You'd think people would have figured this out when the Fox News hosts texts were released and it came out that they all hate Trump
jgm0z1d,Charlotte,12pf1oy,0.3,"Jeff may be making enemies by saying this. He’s pulling back the curtain, and people won’t like that. Because he could easily be talking about people on both sides, including his own.

Even if he’s not talking about members of his side here, he’s exposing political theatrics, which many people participate in. I’m glad he’s doing it, though. Needs to be said.

Also, cynics would say “Is what Jeff’s doing here political theater itself? Is he guilty of it too?” I don’t think that’s necessarily the case, but some will."
jgm11sk,Charlotte,12pf1oy,0.4,"I hear this for sure, but for me it doesn't really matter if they believe it or not.  All that matters is how they vote, and the craziest things that they yell about are how their votes are.  This isn't really reassuring to me.  If anything ""the people you see who are crazy and harmful are also craven and manipulative, and smart enough to know how to calibrate their behavior but terrible enough to let it loose in public"".  That sucks.

""Do they really believe it"" to me, doesn't matter even a little bit.

All that matters is ""are they willing to use their power as a elected official to further that"", if they are, it's doesn't matter if they believe it or not.

That said, I appreciate Jeff saying all this, and it's important to know, but there isn't a real solution here unfortunately, and doubting whether the folks like MTG believe it or not only gives her more of a pass to do what she's doing, which is causing real genuine harm.  I don't care how they are behind closed doors.  The only truth is their votes."
jglxtz3,Charlotte,12pf1oy,-0.8,"Congress being a shit show confirmed, not that we didn't think so before.  Now, we know."
jglupzw,Charlotte,12pf1oy,0.95,"Jeff, you are amazing and we’re lucky to have you. Keep fighting!"
jhxjs3x,Charlotte,130q6rs,-0.4,The only thing that compares to the absolute insanity of 3A is 2A - took 2A everyday for 2 years I think it aged me
jhxpn6l,Charlotte,130q6rs,-0.9,The exit is loose butthole
jhxwstz,Charlotte,130q6rs,-0.7,I take this exit when I really want to fuck with fate.
jhy5ir5,Charlotte,130q6rs,-0.5,You guys know what’s low key just as bad? The Eastway entrance/exit on independence/74
jhydw9d,Charlotte,130q6rs,-0.2,Girlfriend lives in NODA and I almost see God everyday to see her.
jhxmb2h,Charlotte,130q6rs,0.6,What's wrong with 3A? I'm a big 3rd amendment guy. Quartering soldiers in my house? No thank you sir!
jhz65jh,Charlotte,130q6rs,-0.6,"Every time I have to use this exit I’m just like, Fuck it if I die I die, then when I do make it I’m always stuck at the light with a homeless dude staring into my eyes."
jhxl0p8,Charlotte,130q6rs,0.2,"It’s not even the hardest exit in the area.

Trying to exit left to independence from the other side of this is substantially more dangerous and difficult"
jhxfuaz,Charlotte,130q6rs,0.2,"![gif](giphy|3o6wrvdHFbwBrUFenu)

But have you seen 9A-C"
jhxywa2,Charlotte,130q6rs,-0.3,"When I first started working in uptown back in 2021, Maps told me to take exit 3A, knowing nothing about the area. Imagine my face when I had to merge across 3 lanes so I can make a right at the upcoming light. Luckily this was still during the pandemic so traffic was extremely light for 8am. I can't imagine doing that now. Same with John Belk. I get off at W Trade St which is the happy medium."
jiwo54c,Charlotte,138418v,0.4,You know what? Legit use of turncoat.
jiwtzod,Charlotte,138418v,-0.7,It’s particularly interesting how she used her own abortion to talk about how important women’s healthcare and abortion access is but the moment she switches sides she’s all about voting to ban the procedure she was so passionate about for years.
jiwntvb,Charlotte,138418v,-0.9,"The rapid 180 from her platform proves this was the plan all along.  I'm sure she got paid, one way or the other, to be a trojan horse candidate."
jiwmgo1,Charlotte,138418v,-0.6,"It’s beyond frustrating. Especially since one of the most effective things us commoners can do is vote, and this spits in the face of voting."
jiwocit,Charlotte,138418v,-0.9,I’m going to go out and make sure her opposition wins. I heard some people were being nice and protesting further away from her house. But I’d put signs all around her path to work
jiwklyf,Charlotte,138418v,-0.9,"Even worse, she sold her supporters out. She’s the worst kind of traitor but I’m sure the GOP will gerrymander her district to keep her in office."
jiyhe7r,Charlotte,138418v,-0.9,Personally I think every business in Charlotte should refuse to serve her.
jiwnxxs,Charlotte,138418v,-0.5,"Isn't this like house of cards stuff right here?

So it seems like what Tricia did is not against the law but I am curious; is there any way to validate that this wasn't all by design and/or her flipping wasn't for some monetary benefit?"
jiwm8zf,Charlotte,138418v,-0.9,The fact that she can flip-flop with no repercussions or special elections is fucked on all levels.
jiwj8um,Charlotte,138418v,-0.8,Truly rooting for karma to be swift.
jj4v6kh,Charlotte,13a1zc7,0.3,"I was curious,  found an article from Top Gear. This starts out as a Dodge Ram. They also make one using a Bronco and another using a Merc G-wagon"
jj4ztl6,Charlotte,13a1zc7,0.0,An emotional support vehicle.
jj4zs8p,Charlotte,13a1zc7,-0.7,Pontiac Aztec.
jj57suf,Charlotte,13a1zc7,-0.95,Wow! $250k and it started out as a half-ton (IFS gives it away) With 40” tires and 850hp I pray for the front CV axles and ball joints! What a colossal waste of money!
jj51l6i,Charlotte,13a1zc7,-0.3,Its actually the mega evolution of a Nissan Altima
jj5c4k9,Charlotte,13a1zc7,-0.9,Too many dollars and not enough sense
jj5aioa,Charlotte,13a1zc7,-0.9,Imagine driving that around actually thinking you look cool and everyone else doesn’t think you are a complete tool.
jj4ytio,Charlotte,13a1zc7,-0.9,It’s a 2020 “I cheat on my taxes and my fraudulent PPP loan was forgiven”
jj52nxb,Charlotte,13a1zc7,0.2,"Okay, actual answer: it’s an [Apocalypse 6x6](https://www.apocalypse6x6.com/). In this case, based on a Dodge Ram of some kind."
jj50bzv,Charlotte,13a1zc7,0.0,something you hear roaring in the middle of the night
jhjgv62,asheville,12xk6uo,0.9,"Thank you for bringing ""boring"" back to politics, Mr. Jackson.  It's a relief to hear discourse, rather than be forced to watch spectacle."
jhjhjxv,asheville,12xk6uo,0.2,"""Never play chess with a pigeon, they'll knock over the pieces, shit all over the board and then strut around like they won."" Or something like that. I love that you're calling these morons out but don't get too involved in their nonsense, please."
jhj211l,asheville,12xk6uo,0.0,Nobody 2028!
jhj7kr7,asheville,12xk6uo,0.7,"I love this. This is amazing. Please keep up the good work. I also find it hilarious that he knew exactly who you were talking about with no names being named. 
It would be funnier if it were not so frustrating."
jhj2e1t,asheville,12xk6uo,-0.9,"Matt Gaetz, Lauren Broebert and Marjorie Taylor Green are not maniacs. They are good people, great people. The greatest people. Both sides too.

And I'll have you know, ALL of them are totally stable geniuses."
jhj32kc,asheville,12xk6uo,0.9,Someone needs to knit you a cape because you’re a god damn hero.
jhjkb9k,asheville,12xk6uo,-0.5,I like how he keeps licking his lips like he thinks he heath ledgers joker lol
jhj9js7,asheville,12xk6uo,-0.6,Matt Gaetz + Nestor Galban needs to be investigated; that is some shady shit.
jhjp8te,asheville,12xk6uo,0.5,Damnit I like him even more now.
jhkxqq0,asheville,12xk6uo,0.35,“Maybe he’s President of the United States someday.” We can only hope.
jhnqq3l,asheville,12yl15h,0.7,How do you know when this is happening and where to see it? It’s beautiful
jhntuw7,asheville,12yl15h,0.0,At this time of year? At this time of day? In this part of the country? Localized entirely within your kitchen?
jhnwwur,asheville,12yl15h,-0.2,Was this at all visible with your eyes or only the camera?
jhnqgto,asheville,12yl15h,0.7,Great capture!  Just curious - how long of a time frame is condensed into that 21 seconds?
jho0ckt,asheville,12yl15h,-0.4,"Fuck, I missed it again? Dope timelapse!"
jhnq8wg,asheville,12yl15h,0.3,"I noticed something like that a couple months ago when i was driving home, but i could figure out what it was at the time. Thats cool!"
jhntmz9,asheville,12yl15h,-0.2,When was this?
jhnspz0,asheville,12yl15h,0.9,Amazing time lapse. Thanks for not just posting a pic. I hope to one day see one of these. Just missed it here in Chicago
jhnvxq3,asheville,12yl15h,0.9,An Astro Timelapse? Hell yeah! This is awesome!
