id,subreddit,submission_id,score,comment_body
jho36oj,asheville,12yl15h,0.9,Bless you OP for posting this. I was super bummed when I missed it
jglwgla,asheville,12pfe9p,0.9,I'd vote for this guy if he was in our district
jgm1kod,asheville,12pfe9p,-0.5,Videos like this have put the NC GOP into full on war mode against Jeff Jackson. This is the way.
jgly06e,asheville,12pfe9p,0.75,"Respect Jeff, keep it real"
jglziwi,asheville,12pfe9p,-0.4,"But how can you own the libs without yelling and making people angry?? 

Thank you again for your honest and in-touch practice of communication, Jeff!"
jgm1eil,asheville,12pfe9p,0.7,The other way to get attention is to be persistently and consistently rational and honest.
jglwu58,asheville,12pfe9p,0.7,Rock on Jeff!
jglx9sh,asheville,12pfe9p,0.9,"Jeff you’re amazing. Keep doing it the right way, the sane people will support you."
jgmukiu,asheville,12pfe9p,0.9,Legitimately one of the only people in modern politics that I think has honesty and integrity. I hope to see his career flourish.
jgnqa96,asheville,12pfe9p,0.9,Once again he impresses the heck out of me. In one of his first posts he said he would not answer a question if he did not do the research and have a truthful answer - OMG a sane voice in Congress.
jgmdb4m,asheville,12pfe9p,0.3,"He did a similar video a few months back on the same subject. I'm glad he's reiterating it now that he's had a bit of time, and can say he's seen in person.

Edit, found it: Outrage Olympics

https://v.redd.it/4g6rl6fnp0ia1"
jjj411c,asheville,13d4sgb,0.0,"&#x200B;

https://preview.redd.it/fou2tcdqbxya1.jpeg?width=1498&format=pjpg&auto=webp&v=enabled&s=674135d5b477ab2f1a4bc008801b13ac47fc24fa"
jjiw9b7,asheville,13d4sgb,-0.2,Saw that guy in the roundabout by the river last week. I didn't realize that was old Asheville vibes.
jjlc74x,asheville,13d4sgb,-0.6,"Between this guy and the black guy on Smokey Park highway waving the Confederate flag, we have all sides covered."
jjix6r0,asheville,13d4sgb,0.1,"But... they are. That's pretty much the mokita of 2023.

[mokita = the elephant in the room. *Mokita: A known truth left unspoken; think of it as elephant in the room. The word ‘Mokita’ comes from the language of Kilivila, spoken near Papua New Guinea.*](https://janamariefoundation.org/engage/programs/mokita/#:~:text=Mokita%3A%20A%20known%20truth%20left,spoken%20near%20Papua%20New%20Guinea.)"
jjjxma9,asheville,13d4sgb,0.6,"So what I don't understand is with all these people saying the media is dividing is: is that REALLY your argument?  I won't pretend they've had no effect, but me LITERALLY listening to entire speeches, watching ENTIRE segments, NOT out of context, these politicians are polarizing their constitutes.  Acting like the media is automatically pandering is ignorant at best.  I can draw my own conclusions from the LITERAL WORDS AND ACTIONS these politicians and personalities are displaying.  Doesn't take a corrupt media to paint them in an ill manner.

Did the media show bias when Donald Trump bragged about grabbing women's genitalia?  I don't mean to sound like a sympathizer for the media but it really irks me when people suggest pretty much everything is divisive and serves a higher purpose to make people afraid.

I'm very aware that, generally speaking, news outlets exist for a particular reason: to sell ad revenue.  But that doesn't mean good journalism doesn't exist.  By labeling all media as corrupt, you write off investigative journalism.  I'd argue that it's not so black and white."
jjjsuba,asheville,13d4sgb,-0.7,"So this is the nu-Asheville interpretation of what Asheville used to be?

Asheville was live and let live and Republicans and Democrats lived in harmony of I don’t really care what you do. Conservatives, liberals, the gays, the weirdos, the religious, the hippies or whatever you were, everyone for the most part tolerated and got along with each other and nobody gave a fuck since if you weren’t bothering them then what the fuck did they care what you were doing?

Asheville was never Berkeley or San Francisco tier, you and the dude holding this sign who’s most likely a transplant himself fell for the marketing campaign."
jjiznub,asheville,13d4sgb,0.4,Where’s the lie?
jjjpbo6,asheville,13d4sgb,0.4,He’s… not wrong though…
jjk33px,asheville,13d4sgb,0.0,They are.
jjlhugs,asheville,13d4sgb,0.6,Wow people really like to have another tribe to hate... Maybe one day we'll evolve into several individuals able to discuss our differences rationally.
jig8sa8,asheville,134pzlz,-0.9,"Gee maybe that trillion dollar tax breaks to billionaires and corporations wasn't such a great idea.
Just a thought"
jig0ezx,asheville,134pzlz,0.5,Thanks for the update Jeff
jig5i1z,asheville,134pzlz,0.5,"Hi Jeff, in one of your previous videos, you said it's not feasible for the federal government to reach a balanced budget over a 10 year period. Can you explain why you think that?"
jihqguj,asheville,134pzlz,-0.5,"Let it fail.

And then let the real work begin.  Start with the objection to all logic crew and make them accountable."
jij2d7n,asheville,134pzlz,0.5,"Why don't we cut the bloated military budget.   I DON'T mean veteran care.  I mean the millions of dollars spent on tanks we don't need and vehicles rotting in the desert that were built into bloated contracts with ""defense companies"" that politicians all seem to coincidentally have shares in. The billions of dollars we spend on ""research"" that is light-years higher spending than the next 3 highest military spending countries combined...  cut that mess.  And find the holes where our money has been disappearing into for years. 

Close those Tax loopholes and remove the tax cuts for millionaires and billionaires.  Reverse Citizens United.  Outlaw corporate lobbiests.  Or, frankly, all lobbiests.  Why do we bribe our politicians legally?  

And jail the people who have been taking those bribes.  I don't care what your party affiliation is."
jig9gq9,asheville,134pzlz,0.6,"Hi Congressman! Thanks for laying it out.

It seems like Congress has given the Executive contradicting orders: they've authorized spending by passing a budget, but they've limited the debt that can be issued to pay for it. There's a good argument to be made that the debt ceiling isn't legal.

Is it under discussion for the President to instruct the Treasury to continue issuing debt to meet the spending obligations that Congress approved? And to make the Republicans go to court to defend the debt ceiling?"
jigayu8,asheville,134pzlz,-0.5,"I guess there's no way that McCarthy, the slightly left of far right Republicans, and the Dems could work a deal to provide the Speaker an out?"
jigqljp,asheville,134pzlz,-0.9,Our government is terminally dysfunctional; I don't see much hope at this point.
jigkhz8,asheville,134pzlz,-0.6,Hopefully this guy can remain neutral. Of course it’s difficult because currently the gop is a clown car full of issues.
jihixwe,asheville,134pzlz,-0.9,Giving our money to Ukraine was an act of treason.
jhj7qrw,bullcity,12xjdwe,-0.8,"The NewsMax talking head said the quiet part out loud: 

""They're great people to do business with.""

They're in Congress, supposedly to represent their constituents, not to do business! The fact, that they are really stars on an entertainment network and this talking head admitted it, proves Jackson's thesis. 

The grift is so deep it seeps out along the seams."
jhj2x1d,bullcity,12xjdwe,0.7,Well done not naming names or a party in the original clip. It's always fun when people call theirself out
jhj31vh,bullcity,12xjdwe,-0.5,"The funniest thing here is that we can watch the public meetings and social media ourselves and see these people act lowkey or outright crazy. Jeff Jackson actually laid new light and, in a way, complimented them by saying behind closed doors they can be rational people who can do business with others, but then this media gets upset by that somehow. I guess they're so used to people mindlessly watching their shows that they hate when the truth gets out and could make those people think for themselves?"
jhj0wdw,bullcity,12xjdwe,0.9,"When certain news shows get mad at you, it means you’re doing the right thing. Keep fighting the good fight!"
jhj26yq,bullcity,12xjdwe,-0.9,"Newsmax is just Fox without the pretext of “fair and balanced”. 

There isn’t a single rational person that watches that “network”."
jhjh3rp,bullcity,12xjdwe,0.9,"Thank you, Jeff!  Keep up the good work and thanks for helping us try to save NC politics"
jhjb32c,bullcity,12xjdwe,0.9,We love you Jeff!!!
jhjjh66,bullcity,12xjdwe,0.9,Absolutely wonderful Jeff. Keep proving how fake and profit driven this outrage political news cycle really is. Keep making us proud.
jhj5q5q,bullcity,12xjdwe,0.9,"I’d absolutely vote for you for president haha. Make this guy eat his words! Thank you, as always, for being transparent, clear, concise, and having integrity."
jhj614i,bullcity,12xjdwe,-0.6,he is going to eat those words
jgmf716,bullcity,12plexz,-0.9,when can we repeal citizens united
jgmjzv5,bullcity,12plexz,0.9,"Love your videos, Jeff. Thanks for staying transparent and representing our state better than nearly all of our public servants."
jgmm5uh,bullcity,12plexz,0.6,"Thanks for the calm message. While incentive structures can explain part of this public vs. private difference, doesn’t lack of integrity account for more? Public statements and pronouncements are the ones used to rally people around anger.  So the effects of having different beliefs in private don’t really matter, especially for public figures. 

NC should export the state motto “To be, rather than to seem.”"
jgn5yco,bullcity,12plexz,0.15,he’s not telling us anything we didnt already know if you paid enough attention. more politicians should be saying this though.
jgnvdkj,bullcity,12plexz,-0.9,Name and shame them.
jgmlfgl,bullcity,12plexz,0.6,"It’s like watching PG Era WWE. Someone give this man a megaphone and ten minutes uncut post main event. Keep dropping those pipe bombs, Rep. Jackson."
jgnnxha,bullcity,12plexz,0.9,"Anytime anyone anywhere says, ""Show me ONE honest politician"" you can always point to Jeff. 

I hope we get to vote him into the Oval Office some day."
jgmjfid,bullcity,12plexz,0.6,"Thanks, that’s a perspective that isn’t heard very often. It’s disappointing elected officials would play that game, but in some way encouraging that they really don’t believe all the junk."
jgoosoh,bullcity,12plexz,0.9,"Keep it up, would like to see more of our leaders behave this way. You should also call upon us to follow suit."
jgmti3l,bullcity,12plexz,-0.9,"At this point a lot of us have come to the conclusion that politics is like 85% fake. The GOP pretends to care about the working class, democrats pretend to care about minorities, and all the while they link arms and dance in piles of your tax dollars while the press squabbles over the crazy thing MTG just tweeted.

It's not just that our government is an embarrassment, we're just all a massive embarrassment all the way down."
jj8lwv0,bullcity,13avqwu,0.5,Visited them the other day to show solidarity and express my disappointment directly to the store manager. Highly recommend anyone who is so motivated to do so. Just remember to be calm and polite while telling the manager why you are unhappy and won't be spending any more money there until they #bringstevenback
jjdmk2i,bullcity,13avqwu,0.9,"UPDATE! 

As of this morning, the strike has been called off as REI has signed off on the vote request! The NLRB will hold the vote on their proposed date of May 25. Steven was given an update about the administrative leave situation and the workers are confident he will be reinstated soon."
jj8ylob,bullcity,13avqwu,0.5,We were going to go shopping there earlier today and then we just turned around when we saw the striking workers. I’m not crossing a picket line for some shoes! Good luck!
jj8kvof,bullcity,13avqwu,0.6,I support workers and its awesome seeing Durham workers on the national stage over this. What happened with Steve? Was he fired for organizing?
jj8ervd,bullcity,13avqwu,0.7,Thanks for sharing! I shop there often and had no idea.
jj8cq3m,bullcity,13avqwu,0.5,Hell yeah
jj8bqi2,bullcity,13avqwu,0.1,https://actionnetwork.org/forms/respect-rei-workers-let-durham-vote?fbclid=PAAabn2J-WK2c3xtVKYhiwUTqaoa0qlax695Ut3ZarJCocd1j3AN7RUEhcRg4
jj8z64k,bullcity,13avqwu,0.3,"> In a statement, REI said it is “fully supporting the petition process and working closely with the NLRB and the UFCW to ensure every eligible employee has the opportunity to vote for or against union representation.”
> 
> “The co-op is not delaying an election,” an REI spokesperson wrote in an email to the INDY. “Early next week there is a hearing scheduled to discuss the election, which is part of the normal election process. Determining an election date is part of a specific legal process between the co-op, the union and the NLRB. REI’s lawyers are working in good faith with the Union and the NLRB to set an election date, which will be in the coming weeks.”  

https://indyweek.com/news/durham/rei-workers-rally-in-durham-following-union-election-filing/"
jj9zrvt,bullcity,13avqwu,-0.7,Are there scabs working or is the store closed?
jja4epk,bullcity,13avqwu,0.9,I'm really proud of these folks.
jhfl91s,bullcity,12wmqg1,0.9,"Yoo, I haven't even read the riddle yet, but this is hype. Thanks for adding some fun to the city!"
jhfxor2,bullcity,12wmqg1,0.9,"Just to make it super clear; this is NOT hidden on privately owned property, so if you go hunting, please be safe and don’t trespass! 

Cheers!"
jhfffn7,bullcity,12wmqg1,0.9,"I’ve hidden a twenty within our great town.

A little game of “lost” and found.

A treasure hunt from me to you,

But who will find it with these clues?


You won’t have to dig, you won’t have to climb.

All you must do is decipher these rhymes.

They’ll start out vague and may obscure,

But whoever is clever finds treasure for sure.


I’m no Blackbeard or Forrest Fenn, not me.

I don’t have riches to give, you see.

But a little gesture of fun and play

Could really make somebody’s day.


This is your clue, good luck, go seek.

I’ll give another within the week.

Unless someone too quickly finds

The treasure—did they read my mind?


So many beautiful parks in this city!

Some for the doggies (but none for the kitties).

Some for the bicycles, some for the skates

Some for the paddlers, or kids on play dates.


There’s trees, alive and surely dead. 

And where one should protect one’s head. 

Look over and under, beneath and above.

A gift for someone here in Durham, with love."
jhfzaxr,bullcity,12wmqg1,0.7,I was just thinking how something like this would be a super fun thing to do in the area! Maybe I'll dream one up myself :)
jhfpi5s,bullcity,12wmqg1,0.3,I read this in John Mulaney’s voice
jhg4p6y,bullcity,12wmqg1,-0.5,This is a sick idea. I'm stealing it. Pun intended.
jhfisd9,bullcity,12wmqg1,0.9,"You are an amazing person, my friend! This is goi g to be fun!"
jhgvs8y,bullcity,12wmqg1,0.9,"I love this. When I was a kid, the local radio station would put on treasure hunts, releasing clues twice a day for a week to weeks depending on how elaborate they made the hunt. It was my favorite thing. They would hide items that you had to turn in to get the prize- I think one year it was a golden coke bottle, one year a tomahawk (because the prize was a trip to see a braves game). We came close to getting the prize a few times, but never did. I've always wanted someone to do this again!"
jhgxw4j,bullcity,12wmqg1,0.9,This reads like a dr Seuss book. Bravo!
jhgxklx,bullcity,12wmqg1,0.0,"Question, tell me if you don’t want to answer:
If the photo is of use, was this photo taken at the location of hiding?"
jh1w7xx,bullcity,12tavow,-0.9,"Let a motherfucker harass me at my polling station, please."
jh1tlcr,bullcity,12tavow,-0.9,These fascists have become so transparent in their contempt for vast portions of the voting public. Pretty frightening to see how they're methodically following this plan to disenfranchise anyone who they suspect will vote against them...
jh1rcpv,bullcity,12tavow,-0.9,"Suppression efforts like reducing the window for receipt of absentee votes and reducing the early voting period, perhaps?

https://www.democracydocket.com/news-alerts/north-carolina-republicans-introduce-election-day-integrity-act/

https://www.democracydocket.com/news-alerts/north-carolina-republicans-introduce-bill-limiting-early-voting/"
jh1rf1v,bullcity,12tavow,-0.9,"She wants to “combat” encouraging young voters just because they’ll never swing Republican.  voter suppression, only way they win."
jh20pdu,bullcity,12tavow,-0.9,For the last 20 years they’ve lost every fair fight they enter which is why they began abandoning democracy in the 90’s. They’re just no longer hiding it anymore.
jh30lvi,bullcity,12tavow,0.9,"Listen... Even if you're apathetic or uninformed about the state of education in North Carolina, you have to call this out for the bullshit it is. If nothing - NOTHING - else, you owe it to your past self who was a young adult at one point and felt some sense of unfairness about the world around you but couldn't do anything about it. You owe it to that part of your self.

I've taught new and soon-to-be voters for the previous 10 years and I am more inspired by these kids than by any existing generation. That's especially true for my last 5 years of teaching. These kids are empathetic and engaged and feel things with their whole hearts. (We really only hear about the outliers who don't or won't.) As a whole, these kids are ready to get involved and start chipping away at the societal bullshit the rest of us have just been sighing at. It doesn't matter if I disagree with some of their ideas. Hell, if these kids survived the last 7 years of anti-voting fake news and STILL want to vote, I couldn't be prouder. This generation is ready to make needed changes and shake off the apathy, and they need our voting power so they can do what we were never taught to do."
jh1uwa3,bullcity,12tavow,-0.9,"They've all got to go. Vote out every single republican, locally, regionally, and nationally. No one who is loyal to this country would register to be, or remain a republican.

All of them, right out, and in the next election cycle, too."
jh1y3v8,bullcity,12tavow,-0.9,Good luck suppressing the democratic vote in Durham enough to make any difference. What are they going to do? Kill half the people?
jh2ej54,bullcity,12tavow,-0.75,"Anyone else ever feel like they are getting gaslit to the 10th circle of hell? My fear for democracy and the erasure of minorities is palpable in nearly all moments of my life where I’m not consumed by work and sleep and yet - I feel as if the sense of urgency surrounding this is lost around me. It seems to be devolving so quickly, yet I feel relatively alone in my sense of impending doom. Appreciate OP for posting this for awareness, and appreciate all of the similar feedback many in this thread are giving. Hope there is a way we can get through this."
jh3gv7g,bullcity,12tavow,-0.9,"They sound scared. Step on their fucking throats, North Carolina."
jhk4t8v,gso,12xt0u8,0.5,"The Newsmax guy didn't just twist Congressman Jackson's words, he completely lied about what Jackson said. And said exactly what Jackson was trying to say--these people are fine and reasonable behind closed doors. In the last post about this several people were irritated Jackson didn't name names. He didn't need to. Their own ""friends"" outed them."
jhl7ouk,gso,12xt0u8,-1.0,That newsmax guy is creepy as fuck
jhk6spo,gso,12xt0u8,0.7,"Congressman,

Thank you for this and thank you for always trying to be informative, professional and a leader.

My question to you is this:
In your opinion, which is more likely, the parties will continue to move towards populism and  these ""types"" you are referring to will take over the party, or fade away into obscurity?

Will politics become boring again? (God, I hope so)"
jhkeby5,gso,12xt0u8,-0.4,"That ~~""news anchor""~~ *guy* really tries to push that Robert Deniro facial expression, doesn't he?

Edit: Fixed"
jhl403e,gso,12xt0u8,0.75,Loving what Rep Jackson is saying.
jhl6yq5,gso,12xt0u8,-0.9,What a child that anchor is. Reminds me of the anchor from Die Hard that eventually gets punched out.
jhkone6,gso,12xt0u8,-0.4,Newsmax…? Is that like a 24 hour loop of a soap about a news program that brings the tabloids to life?🤔
jhleyej,gso,12xt0u8,0.7,I donated to Jeff Jackson after I saw this latest clip because I wanted to give Newsmax a $10 middle finger.
jhlqynm,gso,12xt0u8,0.9,I love this guy. A rare bright spot in North Carolina politics.
jhlahla,gso,12xt0u8,-0.9,Greg Kelly is a rapist who got off cause his daddy was police commissioner in NYC.
jgnndsh,gso,12pf7sx,0.4,"Here is the thing.  It doesn’t make any difference whether they genuinely believe it or not if they end up supporting and passing the bills.  It does’t matter that you “believe women should be able to have abortions” when in private if you still approve justices who everyone knew would overturn Roe v Wade.

It makes no difference if you believe in private that lgbtq people should be able to just live their life if you undo discrimination laws in order to throw it back to the states and make it their choice.

The whole idea of asking not “how could they believe this” and instead asking “do they even believe it” is irrelevant if the result is the same due to their action or inaction."
jgm2p20,gso,12pf7sx,0.5,"I know he’s a politician, but… like, I kinda really like him. He seems to want to be as honest as he can with us, without getting himself in trouble.  But alas, I have to remember he’s a politician."
jgm9otc,gso,12pf7sx,0.6,"I’m a JJ supporter, but he should name names. Transparency is his MO and transparency serves us all. Discretion here is unnecessary."
jgmortb,gso,12pf7sx,0.95,"This is great. This is how members of Congress should behave and communicate. Real info, no bs. Keep up the fine work sir!"
jgn5ccy,gso,12pf7sx,0.3,More of this guy
jgn178l,gso,12pf7sx,0.7,"Jeff Jackson has that very rare ability to speak plainly about important matters in a way that makes us want to listen to him.

&#x200B;

do with this video was a little less edited though"
jgm7dgi,gso,12pf7sx,0.7,He's pretty well spoken and he's an NC representative. NC is a great state and has some incredible people in it and i think this is an example of it.
jgm6rrd,gso,12pf7sx,-0.5,"hmmm


Got a kind of ""good cop"" vibe here.

It's fine to play the good guy and say what's wrong, but we all alreafy know what's wrong. Name names, dude. Real solutions address specific problems, not ambiguous, nebulous issues."
jgmwb4d,gso,12pf7sx,0.95,"Congressman Jackson, I respect you so much, and think the way you represent yourself on social media and in real life is so honorable. I hope your actions begin to set the standard for politicians moving forward. Thank you for all that you do and all that you represent!"
jgmxvmr,gso,12pf7sx,-0.9,If he’s not calling these clowns out Live during public meetings. He’s basically condoning what they are doing.  “Playing good cop” no longer works when you allow the rot to run the show.
jjcpcdj,gso,13bunuc,-0.8,"Fuck our bullshit two party system.  The fact that all issues need to be either black or white, without any middle ground, is a scam."
jjd10mz,gso,13bunuc,0.9,Who. Is. THIS. Guy? Why don’t we see him on TV every night? This guy has something to say. I need to hear more from him.
jjch8oh,gso,13bunuc,0.9,"We need more calm and level headed people like this man in politics. I don’t give a shit what his party affiliations are, he actually makes me feel like the government can actually get something done."
jjckhi0,gso,13bunuc,-0.9,Well if we could stop the crazy ass new outlets like Fox and Facebook spreading whatever the spread maybe we could get some people back to reality and vote the crazy fuckers out of office
jjcm79o,gso,13bunuc,-0.5,"I really don’t understand why the speaker and other repubs pander to the worst of their party which puts the rest of us Americans at risk. How much longer can all this go on for?
Hopefully, if worst comes to worst, Biden will have the sense to invoke 14th Amendment. America has to pay its bills. Thanks for your input, Mr. Jackson!"
jjcvzro,gso,13bunuc,-0.9,"So, instead of doing what's right for the country our politicians are worried about what other people will say like they're in High School?"
jjd4mch,gso,13bunuc,-0.9,"They're going to wait until the last possible moment, then snatch SS, MC, and Veterans care. Then go home and get a nice fat check from their doners."
jjdlarr,gso,13bunuc,-0.9,"Let it default. I'm game mother-fuckers, if you are"
jjczkuo,gso,13bunuc,-0.9,they are going the same thing they always do pass a continuing resolution and then kick the can down the road for another 90 days.  The Republican Party has been holding this country hostage for about 10 - 12 years now and its not changing.
jjd115z,gso,13bunuc,0.5,Can we just make this guy the fucking president already. I’ve seen 3 videos by him in the last couple weeks and I’m sold. Idc if he’s a republican or a democrat have him run as independent
